<?xml version="1.0" encoding="UTF-8"?>
<QLKS_H2O xmlns:xsi="http://www.w3.org/2001/XMLSchema-instance"
 xsi:noNamespaceSchemaLocation="QLKS_H2O.xsd">
    <LOAIPHONG>
        <MA_LOAIPHONG>SGL</MA_LOAIPHONG>
        <TEN_LOAIPHONG>PHÒNG ĐƠN</TEN_LOAIPHONG>
        <KICHTHUOC>25</KICHTHUOC>
        <MAMAU>#2060d0</MAMAU>
    </LOAIPHONG>
    <LOAIPHONG>
        <MA_LOAIPHONG>TWN</MA_LOAIPHONG>
        <TEN_LOAIPHONG>PHÒNG HAI GIƯỜNG ĐƠN</TEN_LOAIPHONG>
        <KICHTHUOC>30</KICHTHUOC>
        <MAMAU>#20d027</MAMAU>
    </LOAIPHONG>
    <LOAIPHONG>
        <MA_LOAIPHONG>TRP</MA_LOAIPHONG>
        <TEN_LOAIPHONG>PHÒNG BA GIƯỜNG ĐƠN</TEN_LOAIPHONG>
        <KICHTHUOC>50</KICHTHUOC>
        <MAMAU>#d04a20</MAMAU>
    </LOAIPHONG>
    <LOAIPHONG>
        <MA_LOAIPHONG>DBL</MA_LOAIPHONG>
        <TEN_LOAIPHONG>PHÒNG GIƯỜNG ĐÔI</TEN_LOAIPHONG>
        <KICHTHUOC>50</KICHTHUOC>
        <MAMAU>#d04a20</MAMAU>
    </LOAIPHONG>
    <LOAIPHONG>
        <MA_LOAIPHONG>DLX</MA_LOAIPHONG>
        <TEN_LOAIPHONG>PHÒNG GIƯỜNG ĐÔI CÓ VIEW</TEN_LOAIPHONG>
        <KICHTHUOC>50</KICHTHUOC>
        <MAMAU>#13dad2</MAMAU>
    </LOAIPHONG>
    <LOAIPHONG>
        <MA_LOAIPHONG>FAM</MA_LOAIPHONG>
        <TEN_LOAIPHONG>PHÒNG GIA ĐÌNH</TEN_LOAIPHONG>
        <KICHTHUOC>70</KICHTHUOC>
        <MAMAU>#dd23de</MAMAU>
    </LOAIPHONG>
    <VATTU>
        <MA_VATTU>GDN</MA_VATTU>
        <TEN_VATTU>GIƯỜNG ĐƠN</TEN_VATTU>
    </VATTU>
    <VATTU>
        <MA_VATTU>GDB</MA_VATTU>
        <TEN_VATTU>GIƯỜNG ĐÔI</TEN_VATTU>
    </VATTU>
    <VATTU>
        <MA_VATTU>TVI</MA_VATTU>
        <TEN_VATTU>TI VI</TEN_VATTU>
    </VATTU>
    <VATTU>
        <MA_VATTU>TMA</MA_VATTU>
        <TEN_VATTU>TỦ MÁT</TEN_VATTU>
    </VATTU>
    <VATTU>
        <MA_VATTU>MSA</MA_VATTU>
        <TEN_VATTU>MÁY SẤY</TEN_VATTU>
    </VATTU>
    <VATTU>
        <MA_VATTU>MDH</MA_VATTU>
        <TEN_VATTU>MÁY ĐIỀU HÒA</TEN_VATTU>
    </VATTU>
    <VATTU>
        <MA_VATTU>KHT</MA_VATTU>
        <TEN_VATTU>KHĂN TẮM</TEN_VATTU>
    </VATTU>
    <VATTU>
        <MA_VATTU>DEP</MA_VATTU>
        <TEN_VATTU>DÉP</TEN_VATTU>
    </VATTU>
    <VATTU>
        <MA_VATTU>GOI</MA_VATTU>
        <TEN_VATTU>GỐI</TEN_VATTU>
    </VATTU>
    <VATTU>
        <MA_VATTU>CHA</MA_VATTU>
        <TEN_VATTU>CHĂN</TEN_VATTU>
    </VATTU>
    <VATTU>
        <MA_VATTU>BAN</MA_VATTU>
        <TEN_VATTU>BÀN</TEN_VATTU>
    </VATTU>
    <VATTU>
        <MA_VATTU>TUR</MA_VATTU>
        <TEN_VATTU>TỦ</TEN_VATTU>
    </VATTU>
    <VATTU>
        <MA_VATTU>NET</MA_VATTU>
        <TEN_VATTU>THIẾT BỊ MẠNG</TEN_VATTU>
    </VATTU>
    <DICHVU>
        <MA_DICHVU>XEM</MA_DICHVU>
        <TEN_DICHVU>THUÊ XE MÁY</TEN_DICHVU>
        <GIA_DICHVU>130000</GIA_DICHVU>
    </DICHVU>
    <DICHVU>
        <MA_DICHVU>ANS</MA_DICHVU>
        <TEN_DICHVU>ĂN SÁNG</TEN_DICHVU>
        <GIA_DICHVU>40000</GIA_DICHVU>
    </DICHVU>
    <DICHVU>
        <MA_DICHVU>DLI</MA_DICHVU>
        <TEN_DICHVU>DU LỊCH</TEN_DICHVU>
        <GIA_DICHVU>500000</GIA_DICHVU>
    </DICHVU>
    <DICHVU>
        <MA_DICHVU>TXM</MA_DICHVU>
        <TEN_DICHVU>ĐẶT TAXI TỚI SÂN BAY</TEN_DICHVU>
        <GIA_DICHVU>100000</GIA_DICHVU>
    </DICHVU>
    <DICHVU>
        <MA_DICHVU>TXH</MA_DICHVU>
        <TEN_DICHVU>ĐẶT TAXI TỚI BẾN XE</TEN_DICHVU>
        <GIA_DICHVU>100000</GIA_DICHVU>
    </DICHVU>
    <DICHVU>
        <MA_DICHVU>NUO</MA_DICHVU>
        <TEN_DICHVU>NƯỚC SUỐI</TEN_DICHVU>
        <GIA_DICHVU>10000</GIA_DICHVU>
    </DICHVU>
    <DICHVU>
        <MA_DICHVU>CLA</MA_DICHVU>
        <TEN_DICHVU>COCACOLA LON</TEN_DICHVU>
        <GIA_DICHVU>200000</GIA_DICHVU>
    </DICHVU>
    <DICHVU>
        <MA_DICHVU>BIA</MA_DICHVU>
        <TEN_DICHVU>BIA</TEN_DICHVU>
        <GIA_DICHVU>40000</GIA_DICHVU>
    </DICHVU>
    <DICHVU>
        <MA_DICHVU>TTP</MA_DICHVU>
        <TEN_DICHVU>TRANG TRÍ PHÒNG</TEN_DICHVU>
        <GIA_DICHVU>200000</GIA_DICHVU>
    </DICHVU>
    <DICHVU>
        <MA_DICHVU>GUI</MA_DICHVU>
        <TEN_DICHVU>GIẶT ỦI</TEN_DICHVU>
        <GIA_DICHVU>50000</GIA_DICHVU>
    </DICHVU>
    <VATTU_LOAIPHONG>
        <MA_VATTU>GDN</MA_VATTU>
        <MA_LOAIPHONG>SGL</MA_LOAIPHONG>
        <SOLUONG>1</SOLUONG>
    </VATTU_LOAIPHONG>
    <VATTU_LOAIPHONG>
        <MA_VATTU>GDN</MA_VATTU>
        <MA_LOAIPHONG>TWN</MA_LOAIPHONG>
        <SOLUONG>2</SOLUONG>
    </VATTU_LOAIPHONG>
    <VATTU_LOAIPHONG>
        <MA_VATTU>GDN</MA_VATTU>
        <MA_LOAIPHONG>TRP</MA_LOAIPHONG>
        <SOLUONG>3</SOLUONG>
    </VATTU_LOAIPHONG>
    <VATTU_LOAIPHONG>
        <MA_VATTU>GDN</MA_VATTU>
        <MA_LOAIPHONG>DBL</MA_LOAIPHONG>
        <SOLUONG>0</SOLUONG>
    </VATTU_LOAIPHONG>
    <VATTU_LOAIPHONG>
        <MA_VATTU>GDN</MA_VATTU>
        <MA_LOAIPHONG>DLX</MA_LOAIPHONG>
        <SOLUONG>0</SOLUONG>
    </VATTU_LOAIPHONG>
    <VATTU_LOAIPHONG>
        <MA_VATTU>GDN</MA_VATTU>
        <MA_LOAIPHONG>FAM</MA_LOAIPHONG>
        <SOLUONG>2</SOLUONG>
    </VATTU_LOAIPHONG>
    <VATTU_LOAIPHONG>
        <MA_VATTU>GDB</MA_VATTU>
        <MA_LOAIPHONG>SGL</MA_LOAIPHONG>
        <SOLUONG>0</SOLUONG>
    </VATTU_LOAIPHONG>
    <VATTU_LOAIPHONG>
        <MA_VATTU>GDB</MA_VATTU>
        <MA_LOAIPHONG>TWN</MA_LOAIPHONG>
        <SOLUONG>0</SOLUONG>
    </VATTU_LOAIPHONG>
    <VATTU_LOAIPHONG>
        <MA_VATTU>GDB</MA_VATTU>
        <MA_LOAIPHONG>TRP</MA_LOAIPHONG>
        <SOLUONG>0</SOLUONG>
    </VATTU_LOAIPHONG>
    <VATTU_LOAIPHONG>
        <MA_VATTU>GDB</MA_VATTU>
        <MA_LOAIPHONG>DBL</MA_LOAIPHONG>
        <SOLUONG>1</SOLUONG>
    </VATTU_LOAIPHONG>
    <VATTU_LOAIPHONG>
        <MA_VATTU>GDB</MA_VATTU>
        <MA_LOAIPHONG>DLX</MA_LOAIPHONG>
        <SOLUONG>1</SOLUONG>
    </VATTU_LOAIPHONG>
    <VATTU_LOAIPHONG>
        <MA_VATTU>GDB</MA_VATTU>
        <MA_LOAIPHONG>FAM</MA_LOAIPHONG>
        <SOLUONG>2</SOLUONG>
    </VATTU_LOAIPHONG>
    <VATTU_LOAIPHONG>
        <MA_VATTU>TVI</MA_VATTU>
        <MA_LOAIPHONG>SGL</MA_LOAIPHONG>
        <SOLUONG>1</SOLUONG>
    </VATTU_LOAIPHONG>
    <VATTU_LOAIPHONG>
        <MA_VATTU>TVI</MA_VATTU>
        <MA_LOAIPHONG>TWN</MA_LOAIPHONG>
        <SOLUONG>1</SOLUONG>
    </VATTU_LOAIPHONG>
    <VATTU_LOAIPHONG>
        <MA_VATTU>TVI</MA_VATTU>
        <MA_LOAIPHONG>TRP</MA_LOAIPHONG>
        <SOLUONG>1</SOLUONG>
    </VATTU_LOAIPHONG>
    <VATTU_LOAIPHONG>
        <MA_VATTU>TVI</MA_VATTU>
        <MA_LOAIPHONG>DBL</MA_LOAIPHONG>
        <SOLUONG>1</SOLUONG>
    </VATTU_LOAIPHONG>
    <VATTU_LOAIPHONG>
        <MA_VATTU>TVI</MA_VATTU>
        <MA_LOAIPHONG>DLX</MA_LOAIPHONG>
        <SOLUONG>1</SOLUONG>
    </VATTU_LOAIPHONG>
    <VATTU_LOAIPHONG>
        <MA_VATTU>TVI</MA_VATTU>
        <MA_LOAIPHONG>FAM</MA_LOAIPHONG>
        <SOLUONG>1</SOLUONG>
    </VATTU_LOAIPHONG>
    <VATTU_LOAIPHONG>
        <MA_VATTU>TMA</MA_VATTU>
        <MA_LOAIPHONG>SGL</MA_LOAIPHONG>
        <SOLUONG>1</SOLUONG>
    </VATTU_LOAIPHONG>
    <VATTU_LOAIPHONG>
        <MA_VATTU>TMA</MA_VATTU>
        <MA_LOAIPHONG>TWN</MA_LOAIPHONG>
        <SOLUONG>1</SOLUONG>
    </VATTU_LOAIPHONG>
    <VATTU_LOAIPHONG>
        <MA_VATTU>TMA</MA_VATTU>
        <MA_LOAIPHONG>TRP</MA_LOAIPHONG>
        <SOLUONG>1</SOLUONG>
    </VATTU_LOAIPHONG>
    <VATTU_LOAIPHONG>
        <MA_VATTU>TMA</MA_VATTU>
        <MA_LOAIPHONG>DBL</MA_LOAIPHONG>
        <SOLUONG>1</SOLUONG>
    </VATTU_LOAIPHONG>
    <VATTU_LOAIPHONG>
        <MA_VATTU>TMA</MA_VATTU>
        <MA_LOAIPHONG>DLX</MA_LOAIPHONG>
        <SOLUONG>1</SOLUONG>
    </VATTU_LOAIPHONG>
    <VATTU_LOAIPHONG>
        <MA_VATTU>TMA</MA_VATTU>
        <MA_LOAIPHONG>FAM</MA_LOAIPHONG>
        <SOLUONG>1</SOLUONG>
    </VATTU_LOAIPHONG>
    <VATTU_LOAIPHONG>
        <MA_VATTU>MSA</MA_VATTU>
        <MA_LOAIPHONG>SGL</MA_LOAIPHONG>
        <SOLUONG>1</SOLUONG>
    </VATTU_LOAIPHONG>
    <VATTU_LOAIPHONG>
        <MA_VATTU>MSA</MA_VATTU>
        <MA_LOAIPHONG>TWN</MA_LOAIPHONG>
        <SOLUONG>1</SOLUONG>
    </VATTU_LOAIPHONG>
    <VATTU_LOAIPHONG>
        <MA_VATTU>MSA</MA_VATTU>
        <MA_LOAIPHONG>TRP</MA_LOAIPHONG>
        <SOLUONG>1</SOLUONG>
    </VATTU_LOAIPHONG>
    <VATTU_LOAIPHONG>
        <MA_VATTU>MSA</MA_VATTU>
        <MA_LOAIPHONG>DBL</MA_LOAIPHONG>
        <SOLUONG>1</SOLUONG>
    </VATTU_LOAIPHONG>
    <VATTU_LOAIPHONG>
        <MA_VATTU>MSA</MA_VATTU>
        <MA_LOAIPHONG>DLX</MA_LOAIPHONG>
        <SOLUONG>1</SOLUONG>
    </VATTU_LOAIPHONG>
    <VATTU_LOAIPHONG>
        <MA_VATTU>MSA</MA_VATTU>
        <MA_LOAIPHONG>FAM</MA_LOAIPHONG>
        <SOLUONG>1</SOLUONG>
    </VATTU_LOAIPHONG>
    <VATTU_LOAIPHONG>
        <MA_VATTU>MDH</MA_VATTU>
        <MA_LOAIPHONG>SGL</MA_LOAIPHONG>
        <SOLUONG>1</SOLUONG>
    </VATTU_LOAIPHONG>
    <VATTU_LOAIPHONG>
        <MA_VATTU>MDH</MA_VATTU>
        <MA_LOAIPHONG>TWN</MA_LOAIPHONG>
        <SOLUONG>1</SOLUONG>
    </VATTU_LOAIPHONG>
    <VATTU_LOAIPHONG>
        <MA_VATTU>MDH</MA_VATTU>
        <MA_LOAIPHONG>TRP</MA_LOAIPHONG>
        <SOLUONG>1</SOLUONG>
    </VATTU_LOAIPHONG>
    <VATTU_LOAIPHONG>
        <MA_VATTU>MDH</MA_VATTU>
        <MA_LOAIPHONG>DBL</MA_LOAIPHONG>
        <SOLUONG>1</SOLUONG>
    </VATTU_LOAIPHONG>
    <VATTU_LOAIPHONG>
        <MA_VATTU>MDH</MA_VATTU>
        <MA_LOAIPHONG>DLX</MA_LOAIPHONG>
        <SOLUONG>1</SOLUONG>
    </VATTU_LOAIPHONG>
    <VATTU_LOAIPHONG>
        <MA_VATTU>MDH</MA_VATTU>
        <MA_LOAIPHONG>FAM</MA_LOAIPHONG>
        <SOLUONG>1</SOLUONG>
    </VATTU_LOAIPHONG>
    <VATTU_LOAIPHONG>
        <MA_VATTU>KHT</MA_VATTU>
        <MA_LOAIPHONG>SGL</MA_LOAIPHONG>
        <SOLUONG>2</SOLUONG>
    </VATTU_LOAIPHONG>
    <VATTU_LOAIPHONG>
        <MA_VATTU>KHT</MA_VATTU>
        <MA_LOAIPHONG>TWN</MA_LOAIPHONG>
        <SOLUONG>4</SOLUONG>
    </VATTU_LOAIPHONG>
    <VATTU_LOAIPHONG>
        <MA_VATTU>KHT</MA_VATTU>
        <MA_LOAIPHONG>TRP</MA_LOAIPHONG>
        <SOLUONG>6</SOLUONG>
    </VATTU_LOAIPHONG>
    <VATTU_LOAIPHONG>
        <MA_VATTU>KHT</MA_VATTU>
        <MA_LOAIPHONG>DBL</MA_LOAIPHONG>
        <SOLUONG>4</SOLUONG>
    </VATTU_LOAIPHONG>
    <VATTU_LOAIPHONG>